,text,Classification,compound
0,louca pra fazer tatuagem q saco corona vírus,Negative,-0.34
1,"O vídeo que eu vi não mostrou mas bue americanos estavam a responder “ah mas o corona virus não pode ser controlado, uma guerra pode ele não tem culpa disso” mas i mean, ele não fez medidas praticamente nenhumas para evitar a propagação ",Negative,-0.5641
2,"#29Abril | #Coronavirus 24.505 o número de casos confirmados e 973 mortos em #Portugal, revela o boletim desta quarta-feira #COVID19PT",Positive,0.0772
3,"Faz hoje 6 anos em que o Real Madrid esmaga o Bayern por 4-0 na sua casa e Cristiano Ronaldo fez história ao bater mais um recorde europeu, e o próprio levou o Real Madrid até a final de Lisboa no Estádio da Luz. #EFEMERIDE #STOPCOVID19 #Coronavirus #FicaEmCasa #COVID2019",Neutral,0.0
4,"São tempos de recolhimento e ideal para restruturar o futuro, pensando em novas formas de viver, conviver e amar #civismo #sintra #covid_19 #coronavirus #viver #amor #family #gardens #house #realestateagent… https://www.instagram.com/p/B_j9_aPDelh/?igshid=13f6b9ngx3zrv",Positive,0.91
5,Investigadores encontram novo coronavírus em esgotos do estado do Rio de Janeiro http://dlvr.it/RVg6jx Em http://www.TSF.pt,Neutral,0.0
6,Sistema de vigilância da gripe sazonal vai ser alargado ao novo coronavírus http://dlvr.it/RVg2VT Em http://www.TSF.pt,Negative,-0.3818
7,"Paulo Dybala volta a ter teste positivo pela quarta vez em seis semanas. É muito triste, mas é assim. Força, Dybala! #STOPCOVID19 #FicaEmCasa #COVID2019 #Coronavirus ",Positive,0.1016
8,Os que irão para a Fase de Grupos da Champions na próxima época: PSG e Marselha. 3.ªpré-eliminatória: Rennes. #Ligue1 #STOPCOVID19 #Coronavirus #FicaEmCasa,Positive,0.5267
9,Este é o 7° corona virus na humidade o último também surgiu num mercado da China só que só se propragava com com sintomas! Foi a Netflix que disse,Neutral,0.0
10,"Faz hoje também um ano em que foi o título inédito na história do Sporting e de Futsal Português, o título de campeão da Europa de Futsal. 2-1 contra o Kairat na Final de Almaty. #UCLFutsal #FicaEmCasa #STOPCOVID19 #COVID2019 #Coronavirus ",Positive,0.5994
11,"Faz hoje 18 anos em que o Sporting foi campeão nacional pela última vez. Oxalá que no ano que vêm, seremos campeões nacionais, como também o Liverpool está para ganhar a Premier League ao que não acontecia há 30 anos. #EFEMERIDE #STOPCOVID19 #COVID2019 #Coronavirus #FicaEmCasa",Positive,0.9423
12,"@Estadao @correio @GloboNews @policiafederal @MPF_PGR @CNJ_oficial Assim como o combate ao Coronavirus, temos que mudar RADICALMente o acesso a internet, e proibir a divulgação de todas imagens de crianças e adolescentes nas mídias e redes sociais. ",Negative,-0.3818
13,"No passado dia 24, adiaram o Grande Prémio da Finlândia em Moto GP por Coronavirus. Até quando que isto para? #FinnishGP #MotoGP #STOPCOVID19 #COVID2019 #Coronavirus #FicaEmCasa",Neutral,0.0
14,"Esse corona vírus tem que acabar logo, a vida do povo precisa voltar ao normal",Neutral,0.0
15,1 milhão de infectados por corona vírus só nos EUA!!!,Negative,-0.7249
16,"Minha bebê já não teve bolinho de 1 nem 2 meses por conta do corona vírus, dos 3 meses não pode passar em branco",Neutral,0.0
17,Síndrome relacionada com coronavírus identificada em crianças no Reino Unido http://dlvr.it/RVYJqh Em http://www.TSF.pt,Neutral,0.0
18,"A convite do Chefe do Posto Administrativo de Mabaia, a Helpo realizou uma palestra no Bairro 25 de Setembro, Dombe, Província de Manica, Moçambique, com objectivo de difundir mensagens-chave sobre o novo Coronavírus. #helpo #covid19emmocambique",Neutral,0.0
19," ""Uma das muitas consequências do novo coronavírus e consequente distanciamento social foi a subversão da indústria cinematográfica."" Confira a opinião no Jornal Económico, da nossa Estudante Inês Pires e do… https://www.instagram.com/p/B_fKr2ohMCK/?igshid=16anlp9j1i4yt",Neutral,0.0
20,Os jornais desportivos espanhóis de Madrid e de Barcelona unem-se para combater contra o Coromavirus. O lema é o #nuestramejorvictoria. Que serve alguma lição aos jornais desportivos em Portugal. #STOPCOVID19 #COVID2019 #FicaEmCasa #Coronavirus ,Negative,-0.3818
21,"Seria muito provável que a Final da Taça de Portugal deste ano não vai ser realizada, mas pode ser adiada por Coronavirus, entre o Benfica e o Porto. #FinaldaTaça #STOPCOVID19 #COVID2019 #FicaEmCasa #Coronavirus ",Negative,-0.296
22,"Diogo, 34 anos, ator. O ídolo dele, claro, o melhor do mundo, Cristiano Ronaldo. #BB2020 #BB2020tvi #STOPCOVID19 #COVID2019 #Coronavirus ",Positive,0.6369
23,"A Soraia têm 27 anos, e o irmão dela têm o espectro do autismo. Mas ainda assim, continua a ser uma giraça. #BB2020tvi #BB2020 #STOPCOVID19 #FicaEmCasa #COVID2019 #Coronavirus ",Positive,0.6124
24,"A Jéssica que está a viver na Suíça, apesar de ter nascido em Braga, e não têm namorado (como eu que eu não têm namorada). Mas algum dia, vai encontrar a cara metade nesta casa de Big Brother. #BB2020 #BB2020tvi #FicaEmCasa #STOPCOVID19 #COVID2019 #Coronavirus ",Positive,0.1901
25,"Há quantos dias se fala do #Covid19? Desde 31 de dezembro de 2019, pelo menos. Já está muito longe de ser novidade para toda a gente. Menos para a RTP. Para a RTP é sempre o ""novo coronavírus"".",Neutral,0.0
26,"A Sónia não percebe nada das cidades, e confundiu Londres por Paris. Na realidade, ela trouxe uma réplica de Big Ben. #BB2020tvi #STOPCOVID19 #FicaEmCasa #Coronavirus ",Negative,-0.3182
27,Reino Unido regista mais 413 mortes por coronavírus http://dlvr.it/RVV2zW Em http://www.TSF.pt,Neutral,0.0
28,Irão ultrapassa 90 mil infetados por coronavírus http://dlvr.it/RVTyBH Em http://www.TSF.pt,Negative,-0.4939
29,corona vírus vai fazer melhorar a habilidade de andar em pé dentro do ônibus em andamento sem tocar em nada ,Positive,0.7906
